Insult,Comment
1,All these “precious princesses“ kenna schooled from young to think like that. Should just get pumped and dumped and move on.
0,the msg is reasonable what where is the superficial part?
1,"Women have no loyalty, women wont love you like your mother , dont put women on the pedestral dont put her number 1, they dont care how much money you spent on her before and they will leave when there is no more benefit (unless they have no other choice) Below video will wake you up"
0,I find the message reasonable ah...
1,"She got say her friends got suck kkj, CIM and let bf cip? If like that can lah,$300-500 OK rah.But make sure at least 2 twice a few or more. But warn her if her kpi drop you will be replacing her with FW."
1,Not all daughters are equal. Some deserves loser.
1,WHAT A WHORE .
0,Sounds right what. Then you expect your daughter to marry a guy who can't even earn enough to take care of himself meh?
1,Attention seeking whor*
1,err simi lanjiao. Go suck your bro xi kkj since your husband didnt cum inside you for so long
1,can she just diam diam. already shortage of mask and people are helping sg. really ccb.
1,Pappies is the gold standard. Too arrogant to be seen to accept help.
1,"diam lah gong kia, look at ur own kumgongness lol."
1,Wtf this woman got brain anot
0,really jialat max
0,Hope Taiwan donate these. Swee.
0,just in case china buay song
1,Err f off la. Nobody need u to comment
1,"Coach Red Pill mentioned that women look at men and divide them into general 80% of the men (who got no chance in dating them) and the TOP 20% of men (in terms of wealth, looks and fame). Good to see these TOP 20% men fall."
1,TS you suffer from brain damage since young?
1,"Let her kena wuhan & uplorry lor, waste oxygen living on this earth."
1,This type no cure
0,Aunty also quite poor thing.... Can see her frustration... Must be too tired and hungry to walk home eat.....
0,"Why can't we be gracious and give some compassion, it's not like there are people nearby anyway."
1,"she talk cork lah, say wat tired cannot walk back, then how the fark she can come out to buy, sit down and eat...later also must go back wat, haha siao cb, hor cb ki siao"
0,is this a valid excuse???? so let's say she sit on the chair kena covid then go back home spread to grandkids and son how ah?
1,This type of old hag needs someone to give her a good solid pump.
0,"Actually elderly quite poor thing wor...not everyone old liao can stay home got pp go buy essential for them one hor. ownself go buy food, tired liao sit down makan y cannot? Not like got crowd around her...gov should give leeways for elderly"
0,Siao liao I think CB going extend Limpeh going take no pay leave already
1,The self entitled generation was created by PAP so no complaints please. Govt created these idiots & now complain they are not compliant. Pfftt!!
1,Are u farking stupid or something?
1,Maybe need to cane these metal teeth people then they will comply
0,"Hand to heart, u seriously think this CB got use meh?"
1,KNN Ownself die no one care. Don’t spread to others.
1,this type should let her die of covid jitao burn waste oxygen only
0,"wtf why bully elderly, who is likely demented? how is what she is doing worse than the joggers without masks? since MOH already said there is no community spread and the risk of infection is very low, are the CB measures disproportionate? true to our visionary PM Lee's forecast, our curve has flattened after the 11th day. we should begin to review our measures and allow people to eat while maintaining safe distance, for the long term."
0,I'm not condoning her act but she sure has more balls than all keyboard edmwers warrior put together......
1,Fking arrest her and jail her Or force her do hard labour at expo Clean all infected banglas bedsheet la
0,"law has to be enforced la, should just arrest. fining should be only if the person complies immediately after the fine is issued. she doesn't look like she's going to budge."
1,"""lau ahmah, mai kwailan leh, knn tan limpeh hoot li eh lau cb hor li si"
0,"Her back pain. But now she cannot enjoy her meal in peace. Need to scold n curse through her meal. Affect her emotion and mood, lagi worse.."
1,They better don’t breed
0,Govt is now trying to make good a wrong hence they did a CB despite risk to Economy and Ge . So what is wrong with complying
1,He is right. You guys are selfish psychopaths who look at FW as pariah trash and blame them for your own mistakes. Utter pure garbage 3rd world mentality with 1st world infrastructure. No wonder Singaporeans are despised by their neighbours
0,sinkies really... pwn sinkies
1,another one of those stupid PG/MG IBs. these peepur welly ish JLB die better
1,"Diam la sjw, fw not getting any sexual release go jerk them off."
1,siao ding dong
0,"Actually i agree that FW is the victim here, 1st its the Wuhan couple that spread to the church congregation."
1,queen of uglies.
0,"I hope this is just for wayang purposes, and that her actual time is not spent doing grunt work that the masses can do."
0,"If only comment about SG I think still ok since is sinkie, as long don't go kpo comment about other countries."
1,Daft people ken's brainwashed cant help
1,"well, she's useless elsewhere anyway."
1,They meeting you say they hide in their ivory tower. Not knowing the ground. They at ground you want them go meeting at their ivory tower. Now what you want? Make up your bloody mind before you open your mouth.
1,What you mean comrade? Down with the lazy useless oppies !
1,Lol TS use your brain more ....
1,"Alamak, donch tell me TS is so naive as to believe in the wayang? Born yesterday, issit?"
1,"lol, TS is a brainwashed americanised lemming. If the world gets rid of the US, humanity will take a giant step towards world peace and solidarity."
1,Siao lang using IMH WiFi typing nonsense again..
0,lol TS attracted all the defenders in
1,Just nuke China.. do it good. Don't be like Japan so greedy... Just make sure all Chinese in China back then was killed especially the leaders of that era... No such problem will we have today.
0,"TS if you are chinese, you know that if CHINA gets taken down, the rest of the world's chinese will be next right? especially China does a lot of damage in return"
1,Mai gay siao la CCP IB. U only wanna hide behind reputable oversea Chinese becos u know you caused big trouble worldwide and ppl are waiting hold u to account.
1,"lol stupid boy I am not commenting whether China did anything wrong or not. I am just saying if China goes down, ALL chinese goes down as well."
1,"KNN now trying to blend in with us to shield u from danger. Such cowards, Humji say humji lah"
0,"you don't understand. If full scale war between the west and the China happens, there will be deaths in the west even if China loses."
1,"yes, i dont understand at all. i totally dont understand the thinking of commies so forgive me."
1,"I don't a sh*t nor support USA or China. Can someone just nuke China for sake of humanity Yes, i'm a Chinese sinkie"
0,"if china is nuked, u r nuked too"
1,CCP IB confirm. Don’t carry fools on your back.
0,"Please refrain from racial epithets. Yes, China is a bad actor. That doesn't mean all Chinese people are bad. "
1,Cos not everyone is a Washington hoe like u? Sounds like a 9gag fanatic at the same time
1,Idiot Tiongs. Keep coming over to fuel our property.. shld ban them
0,"The virus don’t give a crap whether or not u r tiong or Singaporean That is why the world should unite. There is nothing anti-china. There is nothing anti-chinese. The correct attitude is to avoid ccp killing people in China and outside China the 3rd, the 4th time and so on. Becos anyone can die and it can be our closed ones, and that is why u shouldn’t have blood in your hands"
1,Anyone who reads the nonsense will say your brains got fault
1,Their IQ are all below average. Their thinking are like children. They dont think of the future consequences. 
1,Fug the pap. Fug the wp. Fug the sdp. Fug the sda. Fug the psp. Fug the CCP. Fug the ussr. Fug the USA. Fug ts.
1,fark this fark that is that all the IBs are good for now that their so-called Team A pull blunder after blunder? Maybe they forgot one fark and that go fark yourself ha ha 
1,I Think Your Brain Need A Mask Too
0,Yes. You will need to wear a mask.
1,"Kbkb, erection still retain power. You guys really cannot make it"
1,TS don't need brain if not using right?
1,Circuit breaker really accelerate their mental illness
0,The circuit breaker is just copying what New Zealand is doing