Insult,Comment
0,Sad truth is there are more hot girls than successful guys
1,"To the author, you should just contract covid 19 and die, wasting your life being an ungrateful one when many others aren't as fortunate as you"
0,"Aiyo it's just diff cultures la..china men are known to spoil their gfs and spend money on them like water like that,, they are literally brought up that way lol,,, tbh if he is not spending lavishly on you despite his high salary, why not u just communicate what u want??? why u want to post here let ppl flame u??? im sure you and ur bf stable enough to communicate your expectations right? If buying a Chanel bag for u makes u happy, I'm sure he'll go ahead and do it since he has the monetary means??? unless he is saving up for something then y'all can communicate about it like mature people??? there is no right or wrong la aiyo JUST COMMUNICATE pls"
0,Korean oppa seem to cry alot too. Maybe he thought it would be endearing.
0,Guess all the mid range height population are remaining childless by your hypothesis
0,how like that?
0,Just say u love her lor. Love not just feeling.
0,Tough it out! You can do it
1,Singaporean guys stop being so cheap!...
0,Hi! how about study chinese seriously and japanese as a hobby kinda thing? let's say looking at short comic strips in japanese etc
1,"...erm...you don't sound like you have a problem, so why are you posting here? Or my reading comprehension fail??"
1,Just admit it. U are a person who cant take hardship with ur partner. U quit when the going gets tough. So u dun love any1. U just love urself and want an easy life. Stop giving urself excuses to justify ur thoughts and actions. Lolx.
0,"i'm a loner who studies in CLB, I bet i am the most boring person ever."
1, Didn't know 'hot' and 'fit' is a critical criteria for a gf/future wife. Update us when u are in your 50s/60s. If you are still alive
1,Open leg.. u will earn more than him. Can buy your own bags and own meals
0,"no....no....birkin would be better choice, the one with the limited edition purple crocodile skin"
1,"Yikes, over-evaluated yourself much?"
0,Lol. Hey I am nice and I love tall guys.
1,You grow up la. You then strawberry
1,"Groovelife rings...silicone. Cheap, comfortable,durable and most importantly, it won’t deglove your finger"
0,Weird flex but okay
0,Baby you can drive my car
0,Dun need to marry or court sg girls lah only. The world is so big! Sg only little red dot. Pisai.
0,"A spouse is for a lifetime. No compromise before signing the marriage certificate. Afterwards, compromises are needed to make the companionship last."
0,Ask him for suggestions as to where he would like you two to go.
1, i Am ChRiStIaN bUt ThE sEx Is So GoOd.
0,What's with ladies and their obsession over bags anyway?
0,"This is rubbish and doesn't make any sense. This is like the COVID fake news. It doesn't make any sense for the profs to fail students. First, they don't get more pay for doing that. Second, it makes them look like incompetent teachers.We just have a large number of lousy whiny students who spread such rumours."
1,"If you wanna know why the older generation calls us 'snowflakes' or the 'strawberry generation', simply read this post"
0,Damn yo we still got posts going on about this height thing...
0,Demand and supply
0,Learn to set boundaries with other ppl to avoid hurting their feelings
0,Why compare yourself with others? Do you think you're missing out? Actually nothing to miss out when you are loved by your S/O. Making love is different from having sex and one is better than the other.
0,Please just leave this guy. You can never find happiness in an abusive relation. Find another who loves and protects you. You ain't a punching bag. And you deserve better. No one deserves to be abused. Actually.. it's against the law. Hope you did take photos as evidence
1,"""We cannot go back home bcs we need to serve SHN when we get back."" I stopped reading here because this sentence doesn't make any logical sense. You CAN go back home. You just DON'T WANT to serve SHN when you're back."
0,Try reaching out to your home government for help
1,Stay positive. HIV positive.
1,I only get 10% of the logic in your post
1,"That's game designer talk for ""My cock only 10% erect when I am with you"""
0,Life is unfair OP. I'm really sorry but this is how it is. If you are a scholar they own you
0,"Improve on yourself. Buy some new makeup,change your room decor or buy a new candle or scent or start to learn cooking. Anything to make yourself feel better! Small simple changes give you time to register what have happened and reflect. Take your time and heal."
0,Social distancing
0,Don't friend her anymore lor.
1,"Hence, may I appeal for all of you to stay in Singapore, and avoid bringing back COVID-19 back into Singapore upon your return? This is for the sake of every Singaporean, PR, and foreigner who responsibly chose to remain in Singapore."
1,Your story damn lame leh
0,It is only normal to reply IG stories if you know her well or you are interested in her to get her attention
0,Thats not true. Short girls will find taller guys. Short guys with money will also find tall girls. Just saying
1," Many Singaporean boys have a shit load of complains about who Singaporean women can find attractive/can date, maybe because of they really got no life."
1,Rather than posting err. I rather she don't post anything at all.
1,"Because they always tend to go for the ""exotic looking"" ones (read - ugly), with extremely small eyes or exaggerated Asian features. Most Asian guys won't even find them attractive anyway!"
1,U must be very free to be hantu and take people’s pictures behind their back. Draw some balls for yourself.
0,"If you want to be a vigilante, then go join the police. Why are people so nasty."
0,Wah piang wts is this!!!?
0,what time you pangsai and orh pisai also need to tell us?
1,ts ish no education smelly dog loosers his face rook rike gotch rub wit mrstinkie95 kkj
1,go n commits suicide rah chiu useless dog
0,Go and work stop looking at forums
1,You need professional help.
0,You come here i pay you 600 u bend over so i can shove a broom up ur arse :X
0,McDonald's also need to act pretentious..... Something is wrong
1,Give chance lah. He has nothing else going on in his life leh.
1,Loll .. so triggered then ownself fug off lah
1,"diam lah, talk so much cog"
0,Siaolang. Not happy then dun come online read comments luh
0,"LOL at ibs getting triggered by a mere forum. If anything, you should be thankful that we have a media ranked 154th. Name me another democratic country where the media allow you to get away with making such horrendous judgement calls when lives are at stake."
1,"What the ****??? You all really have brain issue, already say not IB."
0,is kkj ache a symptom of covid 19 or too much prawns??
0,Sinkies are a bunch of whiners
0,Wah no offence. This ts work as blue collar job income so Low. Still can spend so much on food. Jin satki.
0,"you should ask your masters don't act smart gey kiang smlj circuit breaker end up so much confusion. want to lock down, call it a lockdown, then you don't have to blame people for not cooperating."
1,fuking lunatic get a life
1,Take at ur ****ing face la who will like u
0,"Guys, he craves the attention. If we just ignore him, he'll disappear for good"
1,"Really have the ""Will never make it in life"" look"
1,You this chao fker still talk about FW when everybody else is emphasising internal transfer FT. How low can you go?
1,If you just go 'woof woof' you'll make more sense you know
1,You are officially seriously retarded. I feel sad for you.
0,Facts don’t care about your feelings.
1,You all are loser then nobody want to hire you. Please dont blame the foreign talent or government. Please go and live in other countries like you all like Taiwan or Hong Kong see whether you are better.
0,"Here a lot of those who complain richer than u, they are not loser haha"
1,Behind closed doors say u so xia suay. Come out say no Singaporean will be left behind lolol.
0,"Can't even afford to have $5 . Boy , you need help. For a start , if you were to put your effort in enriching yourself in real life instead of typing so much crap, you will have more than $5. People pay you drink beer somemore . You need help."
1,since when he got drive to improve himself? improve in what area? at being useless?
1,Ur the biggest humji still dare talk
1,"just bunch of loser in REAL LIFE , online try to be smart , actually is self owned , go CSI , google etc people info"
0,Jin satki man come lim peh clap for you
0,"TS and white dogs if you all have no ideas and suggestions to help Singaporeans, ministers and the govt to do better. Why don't you shut the fark up?"
0,u look like those chao ah tiong
1,Do us a favour Take a long walk on a short pier Bye You will not be missed
0,Do me a favour and keep off the internet.
1,"When ppl comment, you ask them go run since you so clever. Ask you go run nia, you jjww like a wuss. Dun double standards lah. You comment can, ppl comment must go run ah. Somemore is you jio ppl to run one."
0,wow end shift so late. u are a hardworking and nice guy. hopefully everything goes well for u in life. thanks!
1,Typical lai liao Woof woof woof Can't use logical arguments start to bark liao
0,"How you going to shut us up? Anyway, we are too good to take over govt. People like us who are honest, hardworking and skeptical are not suitable to be public servants."
0,Why you laosai and vomit still drink milk tea? Try to refrain from dairy stuff. It creates nonsense with your tummy acid.
0,Who let the dogs out woof woof woof woof.
0,"Please don't insult professionals. Just because abuses his vocabulary does not mean he has a good grasp on the english language. You could write as ""well"" as him by using a thesaurus."
0,Fully lockdown 1 week! Let them try the feeling especially the stubborn uncle and auntie and Ang Mo!
1,Wise up lar .. if you have nothing positive to contribute to the current situation ... just keep quiet lar. Everytime open mouth also sound like a clown.
1,Like an entitled whore! All these Generals want to show good KPIs so that can pay millions to themselves! Ptui...!
0,Ownself check ownself
0,"High time to put an end to sweeping under the carpet, speak politically correct and take things lightly if it fits the higher up circles."
1,Bloody disgraceful!!!!
0,"If we don’t stop small perverts today, tomorrow they may turn into rapists and spread the genes!"
0,A big SHAME on the public institutionS who had failed her. So much so that a victim has to go out on display in social media to get her story heard!!
1,Hire stupid low life to tell stupid low life like ME to wear mask..
1,Why go toilet need remove mask? He go suck kkj?
1,Face look like aliens from china
0,Wow you guys are missing the big picture. All these comments here are so toxic and self entitled. Truly third world citizens
0,"Evil society never want take care of their elderly, God will punish them."
1,What a stupid expert. If the bats didn't carry all the diseases how could we have Nipah virus.
1,Go to jail disrespectful idiots
1,Put him to sleep. No need to talk
0,"Don't waste time with all these idiot, let them go and fly kite."
1,Selfish A$$holes...
0,"scare mongering article by ST, on a situation in US. these mongrel reporters in ST, are champion ""cut-paste"" reporters. highly paid for doing very little."
1,"shut up,,,,,just do your work or you will be FIRED!!!!!"
1,"Retarded Trump, this is not the time to fight against China! Most importantly can you solve your country's problems? Big mouth! Always, listen! listen! listen! Listen to you doing nothing to the COVID19!"
0,This Donkey Trump has blood in his hands
0,Some enforcements yayapapa...
0,Body slam the fking aggressors pls
0,Isn’t this supposed to be captain obvious?
0,The problem with ppl .. have so much money until become so stupid ... good luck
1,Please grow up and stop being a loser already! There are more important things to do. Jam up the pandemic instead!
0,"Dorm owners, it’s time to reflect. It’s never too late . RESPECT AMITABHA"
1,Pathetic idiots..selfish!!
0,Encourage people to wear masks? What if we get bashed for doing so?
0,"Nonsense measures. They should stop moving workers here and there and just isolate every dormitory! If they want to move workers, test everyone of them first! Very soon. The virus is everywhere in Singapore! They think they are smart to isolate the healthy workers but how healthy are they without testing them?"
0,Delivery fees is already a killer
0,"Please. We don't give a damn about any fake news. We're old enough to discern. Plus this case is such a trivia to deserve any of our time. Just give us what we want to know, where are we now in terms of the war with the virus."
0,Is this necessary? It is presumptuous to single youth out when it’s obvious they are not the most uncooperative
0,Salute to all the medical staff and those on the Frontline. Thank you!! Let's help by STAYING HOME!
0,Zero hope. The monkeys will just go extinct with the 10million population plan.
0,"With blessings, God gives the hygiene accomodation which they had deserved. Prayers for those who are affected to get well soon."
0,You guys need to stop freaking the hell out over the case count. Anything less than the current and forthcoming numbers would indicate we are under testing.
0,Still got room not bad Liao la :(( 14 days to change for future life.. JIA YOU ah!!!
0,"More people die there due to armed robberies, stabbings, gang clashes, cartel wars and hostage situations gone fatal."
0,"Is anxiety an excuse for the ill-informed information snob, braggart? I have seen ppl sharing all kinds of nonsense, quoting unverifiable sources, what is wrong with this ppl?!"
0,This person really northing to do. Should catch / punish him / her. Make me so worries about the full lockdown.
1,Sibeh damn bloody bo liao those idiots!!
0,"we should be ashamed of ourselves.. see how well behaved the monkeys are, social distancing from each other"
1,"Nonsense rubbish.Everywhere close then why markets,clinics open,close all"
0,"Don’t try to divert attention lah! Discuss the dorms instead of the Parks please! ST, you think everyone stupid?"
1,Ah ah deserve it for not hiring Sporeans.
0,Ah... scared kena lim kopi right... ah very good.... ya ya papaya somemore la...
0,Don't say gahment never give chance
0,Ai.....dun report useless news wait your boss.angery
0,Actually who gives a F now when we are all struggling to survive during these hard times ... when things start to get back to normal then talk
0,Nothing to report liao? Expected one mah.. if not rise in passengers meh
1,"Kudos to LTA enforcement officer, cool and composed, you must know your work very well, you understand and calm each and everyone hearing your good advise. (You didn’t realised monkey is recording you too, cause only small dd donkey do monkey business, if you know what I mean) Don’t be disheartened, you are doing a great job under hot sun. You went extramiles which the Country most needed now. With this “I Salute You” and I will salute you whenever I see you. “Well done” and bubbles tea on me!"
0,"put on mask after smoke take only 1 min, small boy also can do it. Argue so much for what"
1,"DIU~~~~ This HGC really asking for it... Later garhemen say all CB dont allow smoking, then you see how many butts you need to eat from every smoker…"
0,"I do agree the LTA officer acted in a professional way, but who confronted who in the first place? LTA said the delivery rider confronted the LTA officer, was that so?? If the rider has been smoking in a non-prohibited place, why did the officer confront the rider? Doesn't he know how to put on a mask properly? Anybody would get upset if an enforcement officer confronted you even though no offence was made. If the LTA officer has mistaken the rider for not putting on a mask while he was smoking, why can't the officer apologies for the mistake? This rider must be very upset for being confronted by so many enforcement officers when he did nothing wrong, but members of the public eyes thinks otherwise."
0,Excuse him...he has no other job.....sure he learnt his lesson... delivery is now very competitive...just give him a break this time.
0,"Because of this LTA officer, the rider still have $300 in your pocket, at least for now. In the end, this money will be spent on cigarettes anyways...sigh."
1,rider no one say you cannot smoke but pls once you inhale the cigarette smoke quickly cover up your mouth with mask and let the smoke exhaust out from your ash hole you understand CCB
1,You dont be so DumbCCB Ash*le can or not? .. Inhale cigarette then put on mask on and off ?? Your blardy common sense teach u is it? U want rider to dye from smoking is it.. Damn stuppiak people think this way is it.. If jogger and those exercise can have priviledge not wearing mask then why smoker cannot only 10 or 15 minutes only somemore the smoke is like fumigation who knows help to kill bad air around like kill mosquitoes ... SO USE YOUR BRAIN... USE YOUR BRAIIIINNNNNNN OK!
0,"""Smoke helps kill virus "" Then everyone from now on must smoke to kill corona virus ."
1,"from the conversation and tone , it obvious who is the sucker"
1,He's smoking in a smoking corner. And he's delivery rider so he's always outdoors. What's wrong with that? Dumbass authorities just want to hit their KPIs
0,The officer didn't fine him.
0,Blindly enforcing cos newly instilled power so he is power hungry
0,"Government forgot to mention that besides strenuous exercise, smokers have to put back on their mask after smoking. It's that simple."
0,You know what is inside the greeny bag behind them!! Not all but If you are unlucky.. 1. Unwashed zero maintenance in it. 2. Overnight spilled sauce or dry up soups. 3. Greeny unwashed uniform and helmets. 4 on the way slipper or old shoe if grabie see one. 5. Last but not least all sort of things you cannot imagine including tinny tiny little ones.  Enjoy your meal.
0,Rider should be thankful that the enforcement officer is a really cool guy.
1,"This motherfcuker Is born to give ppl trouble. This LTA Guy is doing as a part of the nation wide exercise during this period of difficult time, I bravo his attitude towards the nation social responsibility. KNN the motherfcuker, challenge everyone who go against his way. I BET he is only good for doing trash and Asap Rokok rokok. My middle to you."
0,"See a small group of Grab Food deliverymen gathered together on the ground floor chatting happily everyday when they have no business. Approached them nicely and explained to them the CB measures, they all got up and surrounded me wanted to pick a fight. Even patrolling policemen also closed one eye and oblivious to them. Where is the law, LAWrence Wong?"
1,Why bully the old uncle who is trying to help YOU by only doing his job! IF you got the balls go directly to our own Singapore Minister's! Ask them ALL the questions about our country LAW! How to smoke with the Mask on? Why so many foreigners getting Singaporean jobs. SMOKERS CANNOT BE THAT STUPIDLY BLOODYFOOLS!
1,And uncle talks politely too. Not like the dumb delivery creature.
0,"Actually, everyone is stressed. Rider just puts on his mask after smoking and continues with his deliveries. In addition, not an easy job for the enforcement officer. Hope CB ends soon."
0,You don’t have to like what he does. But the fact is simple the govt according to you or rather mr Lawrence wrong did not they say you can’t smoke ? Further the more he was smoking at right location. Was that a crime ? No. Further more you don’t think NEA already knows all these hotspots?
0,So you answered your own argument. It’s not crime. Obviously I am learned I don’t have to try. In this case it was the you and the unlearned LTA officer who was trying too hard
0,"Boy boy, do you challenge someone who gives you sound advice? Somemore that someone explained to you nicely but not being nasty. Whether breaking law or not is another story. It is more about the personal moral and upbringing."
0,Agree. People are trying too hard to challenge at even a very small issue
1,Wow !!! Weather or not breaking the law is another story ? You are joke to the judicial system IN Singapore 🇸🇬 Law is not made for u to follow because it’s convenient for u. It’s all for all the time u moron
0,The cigarette smoke must have clouded his brain.That officer was only reminding him nicely to wear his mask for his own good and that of other peoples and yet he still blew up.
1,Must put on mask when talking and taking video la bodoh. We don't see anyone smoking in this video la bodoh
1,"Grab where got time to bother all these monkeys, he care more about his lifestyle and pockets. These monkeys will parked illegally, go against the traffic flow, smoke and ride at the same time, grab anything they see outside your door. Piece of rubbish grabbie.. Unwashed greeny long t. Grab where got time, he care for his apps, so monkeys poke apps everywhere!!"
0,Take video of them & make report. This kind of CB behaviour not acceptable.
1,Looks like the officer is having a hard time trying to educate a Donkey. Reserved one Goody Bag for the officer once everything is over give him the Bag of Goody.
1,"This uncle handle the situation well, very patient and polite. Whereas the smoker is damn rude and arrogant. You think you are very smart by asking stupid question? To me, you are just a FOOL."
1,DISGUSTING human being on earth parent never send him to school and so misbehave
0,942 cases today. Among the highest in the world. The whole world is asking why only 14 local cars but 928 Dormitory cases. Spotlight is on Singapore. All the 1st world sheen is gone. The ugly racist truth of Singapore is exposed
0,Singaporeans here talk big to hide the filthy conditions that existed in dormitories.
1,"She video it to find any possibility to win,,, so stupid to use such skill and waste of everyone time at this moment."
0,"To be very honest,she is quite cute and sexy. Anyone knows her?"
0,"Shameless Singaporeans. First, their carelessness has caused the foreign workers to be infected. Now talk so big. Foreign workers should have been provided adequate protection and facilities. Why were they exposed to undue risk. Singaporeans are totally irresponsible."
0,"in other countries, foreigners r chased out of country or asked to pay for their own medical expenses…"
0,than you must go to a country that can take of you !
0,You must be Wuhan China Virus. Always hiding the truth. Always telling lies.
1,Free money for them if you don’t wear mask and had an attitude like a CB during CB measures
0,"Her attitude is DISREGARDING the 2 Police officers. Similiar to disregarding the Law of SG. In addition, Disrespect is also a part of it."
0,All mortals you can see in the street can be arrested for wrong. It is those on the street and protect by bodyguards are not to be arrested.
0,Most properly a warning given because she is the VIP under CECA. Another wayang.
0,It’s a harsh statement. Not all Singaporeans are racist. Only few. And we should not be like them because of them. Let’s not make a generic statement as such. Let’s be matured individuals.
0,"But those majority kept quiet and allowed racism to happen. 50 years, nothing was done. So when we keep quiet we also become a party to the crime."
0,Definitely not. But to curse a majority saying everyone will suffer and god should punish them ain’t sanity either.
0,Foreign Workers got infected totally due to fault of locals. These workers got infected due to careless behaviour of locals.
0,"Regardless of race, lang, religion or nationality...one who don't respect the law and putting public health at risk shld be dealt with by the law in the most severe form......the last we want is such action set a precedent for others to follow..........Only with every single individual's social responsibility that this nation and society have a fighting chance to stem the tide of this Virus..."
1,"Why don't send these Covidiots to the dormitories as safe distancing ambassadors, pay them a salary BUT no mask to be put on less they pay $100/day to wear one. Then hopefully these IDIOTS will learn a lesson or two."
0,Yes. That's how it was spread into dormitories. Foreign Workers were made use of as Guinea Pigs and they were put into undue risk till they got infected. Investigation should be conducted as to how this virus was allowed to spread into dormitories
1,lets just hope little barbie doesn't grow up to be as fat as her sister..
0,Haiz...5 kids...hope he able to survive well.
1,"2k want to have 5 kids No pity, dont be a burden to society Pls GTFO"
0,The taxi uncle looks decent and quite smart. Have manager face
1,cos your kkj small.
0,Think this family deserves some help la until the eldest can come out work loh.
1,Covid is the karma for evil people.
1,Everyone is turning to medical industry for treatment and cure instead of places of worship. God can't stop this shite? Or deaths ? And then after all these the egoistic humans will go to god and thank him for everything.
0,It's God's will. no matter how advanced your technology is. It's all part of God's plan.
1,Fark this cb god then
1,Not thinking seriously about something has never been an impediment to holding an opinion about it for many people.
1,superficial meh? you are the loser ah
0,"there are many social truths, u know i know can liao. no need to articulate it clearly and make everybody unhappy."
0,LOL lady hv a lot to lose meh? knn guy lagi more to lose ~~ 
